{
  "schema_version": "1.0.0",
  "register_id": "toolregister",
  "letzte_aenderung": "2026-05-16T04:15:00+00:00",
  "eintraege": [
    {
      "tool_id": "TESSERACT",
      "name": "Tesseract OCR",
      "version": "5.x",
      "kategorie": "ocr",
      "toolgruppe": "OCR",
      "zweck": "Texterkennung in Bildern und PDFs",
      "pfad": "Tools/Tesseract/tesseract.exe",
      "installationsstatus": "installiert",
      "standardtool_ja_nein": true,
      "ersatztool_ja_nein": false,
      "version_status": "zu_pruefen",
      "healthcheck_befehl": "tesseract --version",
      "healthcheck_status": "ungeprueft",
      "update_id": "UPD_TESSERACT",
      "lizenz_id": "TESSERACT",
      "offline_verfuegbar": true,
      "online_erforderlich": false,
      "darf_originale_veraendern": false,
      "darf_von_modulen_verwendet_werden": true,
      "letzte_pruefung": "2026-05-16T04:15:00+00:00",
      "darf_verwendet_werden": true,
      "warnungen": [
        "Version muss genau ermittelt werden",
        "Sprachpakete separat prüfen"
      ]
    },
    {
      "tool_id": "PYMUPDF",
      "name": "PyMuPDF (fitz)",
      "version": "1.23.x",
      "kategorie": "pdf",
      "toolgruppe": "PDF-Verarbeitung",
      "zweck": "PDF-Rendering, Textextraktion, Seitenmanipulation",
      "pfad": "Python/Lib/site-packages/fitz",
      "installationsstatus": "installiert",
      "standardtool_ja_nein": true,
      "ersatztool_ja_nein": false,
      "version_status": "zu_pruefen",
      "healthcheck_befehl": "python -c \"import fitz; print(fitz.__doc__)\"",
      "healthcheck_status": "ungeprueft",
      "update_id": "",
      "lizenz_id": "PYMUPDF",
      "offline_verfuegbar": true,
      "online_erforderlich": false,
      "darf_originale_veraendern": false,
      "darf_von_modulen_verwendet_werden": true,
      "letzte_pruefung": "2026-05-16T04:15:00+00:00",
      "darf_verwendet_werden": true,
      "warnungen": [
        "AGPL-Lizenz prüfen",
        "Nur lesende Operationen für Originalschutz"
      ]
    },
    {
      "tool_id": "DUCKDB",
      "name": "DuckDB",
      "version": "0.10.x",
      "kategorie": "datenbank",
      "toolgruppe": "Datenbank",
      "zweck": "In-Memory analytische Datenbank",
      "pfad": "Tools/DuckDB/duckdb.exe",
      "installationsstatus": "installiert",
      "standardtool_ja_nein": true,
      "ersatztool_ja_nein": false,
      "version_status": "zu_pruefen",
      "healthcheck_befehl": "duckdb --version",
      "healthcheck_status": "ungeprueft",
      "update_id": "",
      "lizenz_id": "DUCKDB",
      "offline_verfuegbar": true,
      "online_erforderlich": false,
      "darf_originale_veraendern": false,
      "darf_von_modulen_verwendet_werden": true,
      "letzte_pruefung": "2026-05-16T04:15:00+00:00",
      "darf_verwendet_werden": true,
      "warnungen": [
        "MIT-Lizenz",
        "Keine Mandantendaten in unverschlüsselte DB"
      ]
    },
    {
      "tool_id": "PYTHON",
      "name": "Python Interpreter",
      "version": "unbekannt",
      "kategorie": "sonstiges",
      "toolgruppe": "Runtime",
      "zweck": "Ausführung aller Python-Module und Runner",
      "pfad": "",
      "installationsstatus": "installiert",
      "standardtool_ja_nein": true,
      "ersatztool_ja_nein": false,
      "version_status": "zu_pruefen",
      "healthcheck_befehl": "python --version",
      "healthcheck_status": "ungeprueft",
      "update_id": "UPD_PYTHON",
      "lizenz_id": "PYTHON",
      "offline_verfuegbar": true,
      "online_erforderlich": false,
      "darf_originale_veraendern": false,
      "darf_von_modulen_verwendet_werden": true,
      "letzte_pruefung": "2026-05-16T04:15:00+00:00",
      "darf_verwendet_werden": true,
      "warnungen": [
        "Version über py --version ermitteln",
        "Kompatibilität mit allen Modulen testen"
      ]
    },
    {
      "tool_id": "POWERSHELL",
      "name": "PowerShell",
      "version": "unbekannt",
      "kategorie": "sonstiges",
      "toolgruppe": "Runtime",
      "zweck": "Ausführung aller Start-Skripte und Autoläufe",
      "pfad": "C:\\Windows\\System32\\WindowsPowerShell\\v1.0\\powershell.exe",
      "installationsstatus": "installiert",
      "standardtool_ja_nein": true,
      "ersatztool_ja_nein": false,
      "version_status": "zu_pruefen",
      "healthcheck_befehl": "powershell -Command \"$PSVersionTable.PSVersion\"",
      "healthcheck_status": "ungeprueft",
      "update_id": "UPD_POWERSHELL",
      "lizenz_id": "POWERSHELL",
      "offline_verfuegbar": true,
      "online_erforderlich": false,
      "darf_originale_veraendern": false,
      "darf_von_modulen_verwendet_werden": true,
      "letzte_pruefung": "2026-05-16T04:15:00+00:00",
      "darf_verwendet_werden": true,
      "warnungen": [
        "Windows-Systemkomponente",
        "Kompatibilität mit Start-Skripten prüfen"
      ]
    },
    {
      "tool_id": "GIT",
      "name": "Git",
      "version": "unbekannt",
      "kategorie": "sicherheit",
      "toolgruppe": "Versionskontrolle",
      "zweck": "Versionskontrolle und Deployment",
      "pfad": "",
      "installationsstatus": "installiert",
      "standardtool_ja_nein": true,
      "ersatztool_ja_nein": false,
      "version_status": "zu_pruefen",
      "healthcheck_befehl": "git --version",
      "healthcheck_status": "ungeprueft",
      "update_id": "UPD_GIT",
      "lizenz_id": "GIT",
      "offline_verfuegbar": true,
      "online_erforderlich": false,
      "darf_originale_veraendern": false,
      "darf_von_modulen_verwendet_werden": true,
      "letzte_pruefung": "2026-05-16T04:15:00+00:00",
      "darf_verwendet_werden": true,
      "warnungen": [
        "GPL-2.0 Lizenz",
        "Keine API-Keys in Git speichern",
        "Keine Mandantendaten committen"
      ]
    },
    {
      "tool_id": "SQLITE",
      "name": "SQLite",
      "version": "unbekannt",
      "kategorie": "datenbank",
      "toolgruppe": "Datenbank",
      "zweck": "Leichte eingebettete Datenbank",
      "pfad": "",
      "installationsstatus": "installiert",
      "standardtool_ja_nein": false,
      "ersatztool_ja_nein": false,
      "version_status": "zu_pruefen",
      "healthcheck_befehl": "python -c \"import sqlite3; print(sqlite3.sqlite_version)\"",
      "healthcheck_status": "ungeprueft",
      "update_id": "UPD_SQLITE",
      "lizenz_id": "SQLITE",
      "offline_verfuegbar": true,
      "online_erforderlich": false,
      "darf_originale_veraendern": false,
      "darf_von_modulen_verwendet_werden": true,
      "letzte_pruefung": "2026-05-16T04:15:00+00:00",
      "darf_verwendet_werden": true,
      "warnungen": [
        "Public-Domain",
        "Migrationstests bei Update erforderlich"
      ]
    },
    {
      "tool_id": "WEBVIEW2",
      "name": "WebView2 Runtime",
      "version": "unbekannt",
      "kategorie": "windows_app",
      "toolgruppe": "Runtime",
      "zweck": "HTML-Rendering für Windows-App UI",
      "pfad": "",
      "installationsstatus": "installiert",
      "standardtool_ja_nein": true,
      "ersatztool_ja_nein": false,
      "version_status": "zu_pruefen",
      "healthcheck_befehl": "reg query \"HKLM\\SOFTWARE\\WOW6432Node\\Microsoft\\EdgeUpdate\\Clients\\{F3017226-FE2A-4295-8BDF-00C3A9A7E4C5}\" /v pv",
      "healthcheck_status": "ungeprueft",
      "update_id": "UPD_WEBVIEW2",
      "lizenz_id": "WEBVIEW2",
      "offline_verfuegbar": true,
      "online_erforderlich": false,
      "darf_originale_veraendern": false,
      "darf_von_modulen_verwendet_werden": true,
      "letzte_pruefung": "2026-05-16T04:15:00+00:00",
      "darf_verwendet_werden": true,
      "warnungen": [
        "Microsoft-Software-Lizenz",
        "Evergreen-Installer bevorzugen",
        "Offline-Installer für Gerichtslaptop bereithalten"
      ]
    },
    {
      "tool_id": "DOTNET_RUNTIME",
      "name": ".NET Runtime",
      "version": "unbekannt",
      "kategorie": "windows_app",
      "toolgruppe": "Runtime",
      "zweck": "Laufzeitumgebung für Windows-App",
      "pfad": "",
      "installationsstatus": "installiert",
      "standardtool_ja_nein": true,
      "ersatztool_ja_nein": false,
      "version_status": "zu_pruefen",
      "healthcheck_befehl": "dotnet --version",
      "healthcheck_status": "ungeprueft",
      "update_id": "UPD_DOTNET",
      "lizenz_id": "DOTNET",
      "offline_verfuegbar": true,
      "online_erforderlich": false,
      "darf_originale_veraendern": false,
      "darf_von_modulen_verwendet_werden": true,
      "letzte_pruefung": "2026-05-16T04:15:00+00:00",
      "darf_verwendet_werden": true,
      "warnungen": [
        "MIT-Lizenz",
        "Offline-Installer bereithalten"
      ]
    },
    {
      "tool_id": "PILLOW",
      "name": "Pillow (PIL)",
      "version": "unbekannt",
      "kategorie": "bildverarbeitung",
      "toolgruppe": "Bildverarbeitung",
      "zweck": "Bildmanipulation und -konvertierung",
      "pfad": "Python/Lib/site-packages/PIL",
      "installationsstatus": "installiert",
      "standardtool_ja_nein": true,
      "ersatztool_ja_nein": false,
      "version_status": "zu_pruefen",
      "healthcheck_befehl": "python -c \"from PIL import Image; print(Image.__version__)\"",
      "healthcheck_status": "ungeprueft",
      "update_id": "",
      "lizenz_id": "PILLOW",
      "offline_verfuegbar": true,
      "online_erforderlich": false,
      "darf_originale_veraendern": false,
      "darf_von_modulen_verwendet_werden": true,
      "letzte_pruefung": "2026-05-16T04:15:00+00:00",
      "darf_verwendet_werden": true,
      "warnungen": [
        "HPND-Lizenz",
        "Nur Arbeitskopien bearbeiten"
      ]
    },
    {
      "tool_id": "NUMPY",
      "name": "NumPy",